date,title,description,source,impact_score,impact_probability,impact_reasoning
2025-01-06 16:00:00,"Federal Reserve Board announces Michael S. Barr will step down from his position as Federal Reserve Board Vice Chair for Supervision, effective February 28, 2025, and will continue to serve as governor","Federal Reserve Board announces Michael S. Barr will step down from his position as Federal Reserve Board Vice Chair for Supervision, effective February 28, 2025, and will continue to serve as governor",www.federalreserve.gov,2.0,60.0,"{'macro_context': 'Mudança na liderança da Fed', 'key_variables': 'Política monetária, taxas de juros', 'usd_correlation': 'Correlação fraca', 'uncertainty_factors': 'Novo vice-presidente, mercados financeiros', 'final_reasoning': 'Pouco provável impacto no curto prazo'}"
2025-01-13 15:00:00,Federal Reserve Board announces the designation of the Chairs and Deputy Chairs of the 12 Federal Reserve Banks for 2025,Federal Reserve Board announces the designation of the Chairs and Deputy Chairs of the 12 Federal Reserve Banks for 2025,www.federalreserve.gov,1.0,20.0,"{'macro_context': 'Designação de líderes dos bancos da Reserva Federal', 'key_variables': 'Política monetária dos EUA', 'usd_correlation': 'Possível impacto indireto', 'uncertainty_factors': 'Novos líderes ainda não demonstraram políticas', 'final_reasoning': 'Efeitos podem ser mínimos no curto prazo'}"
2025-01-14 18:00:00,Federal and state financial regulatory agencies issue interagency statement on supervisory practices regarding financial institutions affected by the California wildfires and straight-line winds,Federal and state financial regulatory agencies issue interagency statement on supervisory practices regarding financial institutions affected by the California wildfires and straight-line winds,www.federalreserve.gov,1.0,20.0,"{'macro_context': 'Notícia localizada nos EUA, pouco impacto no Brasil', 'key_variables': 'Não há variáveis financeiras diretamente afetadas', 'usd_correlation': 'Sem correlação direta com o USD', 'uncertainty_factors': 'Possível impacto indireto em instituições financeiras', 'final_reasoning': 'Baixo impacto e probabilidade de alteração no par USD/BRL'}"
2025-01-17 18:30:00,Federal Reserve Board announces it has withdrawn from the Network of Central Banks and Supervisors for Greening the Financial System (NGFS),Federal Reserve Board announces it has withdrawn from the Network of Central Banks and Supervisors for Greening the Financial System (NGFS),www.federalreserve.gov,2.0,60.0,"{'macro_context': 'Decisão isolada da Reserva Federal', 'key_variables': 'Fluxo de capitais, taxas de juros', 'usd_correlation': 'Possível apreciação do USD no curto prazo', 'uncertainty_factors': 'Reações de outros bancos centrais, mercado ambiental', 'final_reasoning': 'Efeito limitado e temporário'}"
2025-01-20 10:00:00,Results of the December 2024 Survey on credit terms and conditions in euro-denominated securities financing and OTC derivatives markets (SESFOD),Results of the December 2024 Survey on credit terms and conditions in euro-denominated securities financing and OTC derivatives markets (SESFOD),www.ecb.europa.eu,1.0,20.0,"{'macro_context': 'Notícia não diretamente relacionada ao USD/BRL', 'key_variables': 'Não há variáveis afetadas no par', 'usd_correlation': 'Sem correlação evidente', 'uncertainty_factors': 'Incerteza sobre possíveis efeitos indiretos', 'final_reasoning': 'Pouco provável impacto no curto prazo'}"
2025-01-22 10:00:00,Electricity Reform Can Help Usher in Sustainable Growth in The Bahamas,The International Monetary Fund (IMF) published an article on how electricity reform can help usher in sustainable growth in The Bahamas.,www.imf.org,2.0,60.0,"{'macro_context': 'Reforma elétrica nas Bahamas pouco provavelmente impacte diretamente o mercado financeiro brasileiro', 'key_variables': 'Taxa de juros, investimentos estrangeiros, câmbio', 'usd_correlation': 'Correlação fraca ou nula', 'uncertainty_factors': 'Incertezas políticas e econômicas globais', 'final_reasoning': 'Efeito indireto e modesto no curto prazo'}"
2025-01-22 13:18:04,IMF Executive Board Concludes 2024 Article IV Consultation with Malta,The Executive Board of the International Monetary Fund (IMF) concluded the 2024 Article IV consultation with Malta.,www.imf.org,1.0,10.0,"{'macro_context': 'Consultation with Malta', 'key_variables': 'Minimal direct impact', 'usd_correlation': 'No significant correlation', 'uncertainty_factors': 'Geopolitical events, economic indicators', 'final_reasoning': 'Low impact on USD/BRL'}"
2025-01-22 13:19:23,IMF Executive Board Concludes 2024 Article IV Consultation with Oman,The Executive Board of the International Monetary Fund (IMF) concluded the 2024 Article IV consultation with Oman.,www.imf.org,1.0,20.0,"{'macro_context': 'Consultation with Oman has limited direct impact on USD/BRL', 'key_variables': ""Oman's economy, IMF policies"", 'usd_correlation': 'Weak correlation with USD/BRL', 'uncertainty_factors': 'Global economic conditions, political events', 'final_reasoning': 'Low impact expected on USD/BRL'}"
2025-01-22 18:32:32,"IMF Executive Board Completes the Sixth Review under the Extended Credit Facility Arrangement and the Second Review under the Resilience and Sustainability Facility Arrangement, and Concludes the 2024 Article IV Consultation with Niger","The Executive Board of the International Monetary Fund (IMF) completed the sixth review under the Extended Credit Facility Arrangement and the second review under the Resilience and Sustainability Facility Arrangement, and concluded the 2024 Article IV consultation with Niger.",www.imf.org,2.0,60.0,"{'macro_context': 'Niger not directly related to USD/BRL', 'key_variables': ""IMF arrangement, Niger's economy"", 'usd_correlation': 'Weak negative correlation', 'uncertainty_factors': 'Global market sentiment, commodity prices', 'final_reasoning': 'Minor short-term impact'}"
2025-01-23 03:30:00,IMF Executive Board Concludes 2024 Article IV Consultation Discussions with the People s Republic of China Hong Kong Special Administrative Region,The Executive Board of the International Monetary Fund (IMF) concluded the 2024 Article IV consultation discussions with the People s Republic of China Hong Kong Special Administrative Region.,www.imf.org,2.0,40.0,"{'macro_context': 'Consultation discussions with Hong Kong SAR', 'key_variables': 'Investment flows, economic stability', 'usd_correlation': 'Limited direct correlation', 'uncertainty_factors': 'Political tensions, global economic factors', 'final_reasoning': 'Minimal impact expected on USD/BRL'}"
2025-01-23 16:00:00,Federal Reserve Board announces termination of enforcement action with Marblehead Bancorp and Marblehead Bank,Federal Reserve Board announces termination of enforcement action with Marblehead Bancorp and Marblehead Bank,www.federalreserve.gov,1.0,20.0,"{'macro_context': 'Notícia específica de um banco nos EUA', 'key_variables': 'Confiança do mercado, taxa de juros', 'usd_correlation': 'Fraca e indireta', 'uncertainty_factors': 'Outras notícias econômicas, decisões de bancos centrais', 'final_reasoning': 'Pouco provável impacto no curto prazo'}"
2025-01-27 05:00:00,IMF Executive Board Concludes 2024 Article IV Consultation with Albania,The Executive Board of the International Monetary Fund (IMF) concluded the 2024 Article IV consultation with Albania.,www.imf.org,1.0,10.0,"{'macro_context': 'Consultation with Albania', 'key_variables': 'Albanian economy, IMF policies', 'usd_correlation': 'Minimal direct correlation', 'uncertainty_factors': 'Global economic shifts, political events', 'final_reasoning': 'Negligible impact on USD/BRL'}"
2025-01-27 10:00:00,Survey on the Access to Finance of Enterprises: firms report lower interest rates but a small decline in bank loan availability,Survey on the Access to Finance of Enterprises: firms report lower interest rates but a small decline in bank loan availability,www.ecb.europa.eu,2.0,60.0,"{'macro_context': 'Estabilidade econômica do Brasil', 'key_variables': 'Taxa de juros, disponibilidade de empréstimos', 'usd_correlation': 'Correlação fraca', 'uncertainty_factors': 'Flutuações do mercado, decisões de política monetária', 'final_reasoning': 'Pouco provável impacto no curto prazo'}"
2025-01-27 10:57:47,IMF Executive Board Concludes 2024 Article IV Consultation with Cambodia,The Executive Board of the International Monetary Fund (IMF) concluded the 2024 Article IV consultation with Cambodia.,www.imf.org,1.0,20.0,"{'macro_context': 'Consultation between IMF and Cambodia', 'key_variables': 'Minimal direct impact on USD/BRL', 'usd_correlation': 'No significant correlation', 'uncertainty_factors': 'Political and economic stability in Cambodia', 'final_reasoning': 'Low impact expected on USD/BRL'}"
2025-01-28 07:52:13,XRP avan\u00e7a 11  em um dia de alta,"O XRP teve um avan\u00e7o de 11  em um dia de alta para as criptomoedas, mostrando um desempenho positivo em meio \u00e0 volatilidade do mercado.",br.investing.com,2.0,40.0,"{'macro_context': 'Mercado de criptomoedas volátil', 'key_variables': 'Preço e demanda por XRP', 'usd_correlation': 'Pouca influência direta', 'uncertainty_factors': 'Regulamentação, adoção, concorrência', 'final_reasoning': 'Efeito limitado no curto prazo'}"
2025-01-28 10:00:00,January 2025 euro area bank lending survey,Survey on the Access to Finance of Enterprises: firms report lower interest rates but a small decline in bank loan availability,www.ecb.europa.eu,2.0,40.0,"{'macro_context': 'Euro area bank lending survey has limited direct impact on USD/BRL', 'key_variables': 'Interest rates, loan availability for euro area firms', 'usd_correlation': 'Weak correlation with USD', 'uncertainty_factors': 'Global economic trends, monetary policy decisions', 'final_reasoning': 'Low impact expected on USD/BRL in the short term'}"
2025-01-28 10:07:59,Copom deve elevar juros em 100 pontos-base em decis\u00e3o com tom hawkish,"O Comit\u00ea de Pol\u00edtica Monet\u00e1ria (Copom) sinaliza um aumento de 100 pontos-base na taxa de juros, em uma decis\u00e3o com vi\u00e9s hawkish. Entenda as perspectivas do mercado sobre essa medida.",br.investing.com,4.0,85.0,"{'macro_context': 'Contexto de alta inflação no Brasil', 'key_variables': 'Taxa de juros, inflação, expectativas de mercado', 'usd_correlation': 'Correlação inversa: real se fortalece com juros mais altos', 'uncertainty_factors': 'Dados econômicos, decisões do FOMC', 'final_reasoning': 'Aumento da demanda por real e redução de fluxo de capitais para o exterior'}"
2025-01-28 10:44:11,Cardano tem alta de 10  em dia majoritariamente positivo,"A Cardano registrou um aumento de 10  em um dia majoritariamente positivo para o mercado de criptomoedas, refletindo o otimismo dos investidores.",br.investing.com,2.0,60.0,"{'macro_context': 'Mercado de criptomoedas majoritariamente positivo', 'key_variables': 'Preço da Cardano', 'usd_correlation': 'Pouca correlação direta com o USD/BRL', 'uncertainty_factors': 'Volatilidade inerente ao mercado de criptomoedas, decisões regulatórias', 'final_reasoning': 'Possível leve pressão alcista no curto prazo'}"
2025-01-28 12:09:43,D\u00f3lar e Ibovespa hoje: o que esperar dos neg\u00f3cios na B3 nesta ter\u00e7a,Acompanhe as expectativas para os neg\u00f3cios envolvendo o d\u00f3lar e o Ibovespa na B3 nesta ter\u00e7a-feira. Fique por dentro das proje\u00e7\u00f5es e an\u00e1lises do mercado financeiro.,br.investing.com,2.0,60.0,"{'macro_context': 'Sem informações relevantes no contexto macroeconômico', 'key_variables': 'Nenhuma variável específica afetada nesta notícia', 'usd_correlation': 'Nenhuma correlação direta com o USD mencionada', 'uncertainty_factors': 'Expectativas de negócios na B3 nesta terça-feira', 'final_reasoning': 'Pouco provável que haja impacto significativo no USD/BRL'}"
2025-01-28 14:15:22,Investidores da Nvidia t\u00eam maior preju\u00edzo di\u00e1rio da hist\u00f3ria; saiba o que fazer,"Os investidores da Nvidia enfrentaram perdas significativas, resultando no maior preju\u00edzo di\u00e1rio j\u00e1 registrado. Descubra as poss\u00edveis a\u00e7\u00f5es a serem tomadas diante desse cen\u00e1rio.",br.investing.com,2.0,40.0,"{'macro_context': 'Notícia específica de empresa, sem impacto imediato no contexto macroeconômico', 'key_variables': 'Cotação de ações da Nvidia', 'usd_correlation': 'Sem relação direta com o par USD/BRL', 'uncertainty_factors': 'Flutuações do mercado de ações, decisões de investidores', 'final_reasoning': 'Pouco provável impacto no curto prazo no par USD/BRL'}"
2025-01-28 15:10:17,Metaplanet planeja aumentar reserva de bitcoin em cerca de US  745 milh\u00f5es,"A Metaplanet anunciou planos de aumentar sua reserva de bitcoin em aproximadamente US  745 milh\u00f5es, demonstrando confian\u00e7a na criptomoeda.",br.investing.com,2.0,60.0,"{'macro_context': 'Crypto market volatility', 'key_variables': 'Bitcoin price, forex market sentiment', 'usd_correlation': 'Weak positive correlation', 'uncertainty_factors': 'Regulatory changes, global economic stability', 'final_reasoning': 'Minor impact on short-term USD/BRL dynamics'}"
2025-01-28 15:55:27,Piper Sandler discute impacto da DeepSeek na minera\u00e7\u00e3o de bitcoin,"A Piper Sandler analisa o impacto do DeepSeek na minera\u00e7\u00e3o de bitcoin, trazendo insights sobre as consequ\u00eancias desse fen\u00f4meno no mercado de criptomoedas. Saiba mais.",br.investing.com,2.0,60.0,"{'macro_context': 'Mercado de criptomoedas volátil', 'key_variables': 'Preço do Bitcoin, atividade de mineração', 'usd_correlation': 'Correlação fraca e instável', 'uncertainty_factors': 'Regulamentação, tecnologia de mineração', 'final_reasoning': 'Pouco provável impacto significativo no curto prazo'}"
2025-01-28 15:55:39,"Receitas federais crescem 9,62  em 2024 e batem recorde com atividade forte e medidas arrecadat\u00f3rias","As receitas federais tiveram um crescimento expressivo em 2024, alcan\u00e7ando um novo recorde impulsionado pela atividade econ\u00f4mica robusta e medidas de arrecada\u00e7\u00e3o. Saiba mais sobre esse desempenho.",br.investing.com,2.0,60.0,"{'macro_context': 'Crescimento das receitas federais pode indicar estabilidade econômica', 'key_variables': 'Taxa de juros, balança de pagamentos, confiança do consumidor', 'usd_correlation': 'Possível impacto leve e positivo no curto prazo', 'uncertainty_factors': 'Outros fatores econômicos, decisões políticas', 'final_reasoning': 'Pequeno impacto positivo no par USD/BRL'}"
2025-01-28 16:30:44,"Efeito DeepSeek nas a\u00e7\u00f5es da Weg foi \""muito extremo\"", diz Citi","O impacto do DeepSeek nas a\u00e7\u00f5es da Weg surpreendeu o Citigroup, que considerou a rea\u00e7\u00e3o do mercado como muito intensa. Entenda mais sobre essa an\u00e1lise.",br.investing.com,2.0,60.0,"{'macro_context': 'Estabilidade geral do mercado cambial', 'key_variables': 'Cotas de exportação, confiança do consumidor', 'usd_correlation': 'Correlação fraca', 'uncertainty_factors': 'Flutuações no setor de commodities, decisões da FED', 'final_reasoning': 'Pouco provável impacto no curto prazo'}"
2025-01-28 16:31:16,Petrobras (PETR4) pode realizar reajuste? Analistas avaliam medida como positiva,"A Petrobras est\u00e1 avaliando a possibilidade de um reajuste, e analistas consideram essa medida como positiva para a empresa. Saiba mais sobre essa an\u00e1lise.",br.investing.com,3.0,60.0,"{'macro_context': 'Estabilidade econômica do Brasil', 'key_variables': 'Preço do petróleo, investimentos estrangeiros', 'usd_correlation': 'Inversamente proporcional ao real', 'uncertainty_factors': 'Volume do reajuste, fluxo de caixa da Petrobras', 'final_reasoning': 'Potencial apreciação do dólar no curto prazo'}"
2025-01-28 17:41:03,"Forte ciclo de alta de juros deve criar problemas para as empresas, como investir?",O cen\u00e1rio de um ciclo de alta de juros intenso levanta preocupa\u00e7\u00f5es sobre o impacto nas empresas. Descubra estrat\u00e9gias de investimento para lidar com esse ambiente desafiador.,br.investing.com,4.0,80.0,"{'macro_context': 'Cenário de alta taxa de juros nos EUA', 'key_variables': 'Taxa de juros, câmbio, dívida externa', 'usd_correlation': 'Correlação positiva forte', 'uncertainty_factors': 'Inflação, crescimento econômico', 'final_reasoning': 'Aumento da pressão sobre o BRL no curto prazo'}"
2025-01-28 18:12:21,"Telecom: Mesmo com infla\u00e7\u00e3o, dividendos devem seguir robustos, acredita Santander","O setor de telecomunica\u00e7\u00f5es mant\u00e9m a perspectiva de dividendos robustos, mesmo diante do cen\u00e1rio de infla\u00e7\u00e3o. O Santander expressa confian\u00e7a nessa tend\u00eancia. Saiba mais.",br.investing.com,2.0,40.0,"{'macro_context': 'Inflação e taxas de juros nacionais', 'key_variables': 'Taxa de juros, expectativas de investidores', 'usd_correlation': 'Pouca influência direta', 'uncertainty_factors': 'Flutuações do mercado, decisões regulatórias', 'final_reasoning': 'Efeito limitado no curto prazo'}"
2025-01-28 18:29:00,IMF Executive Board Concludes 2024 Article IV Consultation with Bolivia,The Executive Board of the International Monetary Fund (IMF) concluded the 2024 Article IV consultation with Bolivia.,www.imf.org,2.0,60.0,"{'macro_context': 'Consulta periódica do FMI com Bolívia', 'key_variables': 'Reservas internacionais, taxa de câmbio', 'usd_correlation': 'Pouca influência direta', 'uncertainty_factors': 'Recomendações do FMI, decisões governamentais', 'final_reasoning': 'Efeitos moderados e incertos no curto prazo'}"
2025-01-28 19:32:26,Varejo: Como navegar a tempestade macro? XP elenca preferidas e rebaixa Petz,O setor de varejo tem enfrentado desafios diante do cen\u00e1rio macroecon\u00f4mico atual. A XP Investimentos listou suas prefer\u00eancias no setor e rebaixou a Petz. Saiba mais.,br.investing.com,2.0,60.0,"{'macro_context': 'Desafios no setor de varejo por cenário macroeconômico', 'key_variables': 'Consumo, investimentos, câmbio', 'usd_correlation': 'Pouca influência direta no curto prazo', 'uncertainty_factors': 'Outros fatores específicos do setor', 'final_reasoning': 'Pouco impacto esperado no par USD/BRL'}"
2025-01-28 20:40:08,Criptomoedas: bitcoin se recupera ap\u00f3s liquida\u00e7\u00e3o por DeepSeek e retoma n\u00edvel dos US  100 mil,"O bitcoin se recuperou ap\u00f3s uma liquida\u00e7\u00e3o causada pela DeepSeek e voltou a atingir o n\u00edvel dos US  100 mil, mostrando resili\u00eancia no mercado de criptomoedas.",br.investing.com,2.0,60.0,"{'macro_context': 'Estabilidade geral do mercado de criptomoedas', 'key_variables': 'Preço do Bitcoin, investimento em criptomoedas', 'usd_correlation': 'Correlação fraca e variável', 'uncertainty_factors': 'Regulamentação, cibersegurança', 'final_reasoning': 'Pouco provável impacto direto no curto prazo'}"
2025-01-28 20:40:36,"'Vivemos pico de gargalo em cont\u00eaineres nos portos', afirma CEO da SLC Agr\u00edcola (SLCE3)","O CEO da SLC Agricola (SLCE3), Aur\u00e9lio Pavinato, afirmou nesta ter\u00e7a-feira (28) que apesar dos avan\u00e7os quanto aos gargalos log\u00edsticos nos portos brasileiros, o Brasil vive um pico do gargalo de cont\u00eaineres. \""Atualmente, n\u00e3o temos praticamente gargalos na parte de gr\u00e3os nos portos brasileiros. Com todo o Corredor Norte que foi desenvolvido, pelo incremento na capacidade nos portos do Sudeste e",www.moneytimes.com.br,2.0,60.0,"{'macro_context': 'Logistical bottlenecks in Brazilian ports', 'key_variables': 'Export volumes, trade balance', 'usd_correlation': 'Indirect negative correlation', 'uncertainty_factors': 'Government policies, infrastructure development', 'final_reasoning': 'Minor impact on USD/BRL in the short term'}"
2025-01-28 21:19:21,Vale (VALE3) tem queda em produ\u00e7\u00e3o e vendas de min\u00e9rio de ferro no 4T24,"A Vale (VALE3) divulgou nesta ter\u00e7a-feira (28) o relat\u00f3rio referente ao quarto trimestre de 2024 (4T24), com quedas na produ\u00e7\u00e3o e vendas de min\u00e9rio de ferro, crescimento no cobre e estabilidade no n\u00edquel. A produ\u00e7\u00e3o de min\u00e9rio de ferro somou 85,3 milh\u00f5es de toneladas no 4T24, queda de 4,6  frente ao 4T23 e de 6,3  em",www.moneytimes.com.br,2.0,60.0,"{'macro_context': 'Contexto de demanda reduzida de minério de ferro', 'key_variables': 'Preço do minério de ferro, balança comercial do Brasil', 'usd_correlation': 'Correlação fraca, pois impacto direto é no real', 'uncertainty_factors': 'Outros fatores geopolíticos e econômicos', 'final_reasoning': 'Possível leve queda no curto prazo no par USD/BRL'}"
2025-01-28 21:21:28,"Ibovespa cai na v\u00e9spera da 'Super-Quarta' e destoa da recupera\u00e7\u00e3o de Wall Street; d\u00f3lar recua a R  5,86","Em mais um dia de espera pela 'Super-Quarta', o Ibovespa (IBOV) devolveu parte dos ganhos da v\u00e9spera e encerrou as negocia\u00e7\u00f5es em queda. O movimento foi puxado por Vale (VALE3), que caiu mais de 2 , e pela liquidez limitada por China com o feriado do \""Ano Novo Chin\u00eas\"". A recupera\u00e7\u00e3o das bolsas de Nova York ajudaram a",www.moneytimes.com.br,3.0,60.0,"{'macro_context': ""Market anticipation for 'Super-Quarta' and Chinese New Year holiday affecting liquidity"", 'key_variables': 'Ibovespa, Vale (VALE3), China liquidity', 'usd_correlation': 'Inverse correlation due to reduced demand for USD in Brazil', 'uncertainty_factors': 'Global market volatility, economic indicators from China', 'final_reasoning': 'Potential short-term weakness in USD/BRL'}"
2025-01-28 21:27:37,"Casa Branca avalia efeitos do DeepSeek \u00e0 seguran\u00e7a nacional, diz autoridade local","Autoridades norte-americanas est\u00e3o analisando as implica\u00e7\u00f5es do aplicativo chin\u00eas de intelig\u00eancia artificial DeepSeek para a seguran\u00e7a nacional, disse a secret\u00e1ria de imprensa da Casa Branca, Karoline Leavitt, nesta ter\u00e7a-feira (28). O Conselho de Seguran\u00e7a Nacional est\u00e1 analisando as implica\u00e7\u00f5es do aplicativo, disse. \""Este \u00e9 um alerta para a ind\u00fastria norte-americana de IA\"", afirmou Leavitt, acrescentando",www.moneytimes.com.br,2.0,40.0,"{'macro_context': 'Geopolitical tensions between US and China', 'key_variables': 'Investor confidence, capital flows', 'usd_correlation': 'Potential safe-haven demand for USD', 'uncertainty_factors': ""DeepSeek's specific impact unclear"", 'final_reasoning': 'Minimal impact expected in the short term'}"
